section,text
,"In a mixing bowl, beat together {{eggs_choice}}, {{milk_choice}}, and {{water}} until smooth."
,Whisk in {{butter_choice}}.
,"Add {{flour_choice}}, {{salt}}, and {{sugar}}. Blend thoroughly until the batter is smooth and lump-free."
,Heat a skillet over medium heat and melt a little {{butter_pan}} to coat the surface (repeat before each crepe).
,Pour about 1/4 cup of batter into the center of the skillet and tilt the pan so the batter spreads evenly.
,Cook until the bottom is light brown and the surface looks set and slightly bubbly.
,Flip gently with a spatula.
,"Cook the second side until light brown, then remove and keep warm. Repeat with remaining batter."
